"Name";"Deparment";"Institution";"Program";"Title";"Term";"amount"
"Lethbridge, Timothy TC";"Information Technology and Engineering, School of";"Ottawa";"RGPIN";"Evaluating and improving the Umple model-oriented programming language";"5";29000;29000;2011
"Li, Ming M";"Computer Science, David R. Cheriton School of";"Waterloo";"RGPIN";"Bioinformatics software tools and Kolmogorov complexity";"5";76000;76000;2011
"Lin, Guohui GH";"Computing Science";"Alberta";"RGPIN";"Algorithm design and analysis, web-database and web-server development in bioinformatics research driven by large volume data";"5";24000;24000;2011
"Locasto, Michael NE";"Computer Science";"Calgary";"RGPIN";"Supporting software security by measuring, coordinating, and enforcing software trustworthiness";"5";29000;29000;2011
"Lowe, David DG";"Computer Science";"British Columbia";"RGPIN";"Object category recognition with large training sets";"5";49000;49000;2011
"Lyons, Kelly KA";"Information, Faculty of";"Toronto";"RGPIN";"Systematic Integration of Web 2.0 and Web 3D Tools in Service Systems";"1";14000;14000;2011
"Ma, Bin B";"Computer Science, David R. Cheriton School of";"Waterloo";"RGPIN";"Bioinformatics tools for proteomics research";"5";49000;49000;2011
"Mackworth, Alan AK";"Computer Science";"British Columbia";"RGPIN";"Constraint-based agents";"5";24000;24000;2011
"Maheshwari, Anil A";"Computer Science, School of";"Carleton";"RGPIN";"Design, analysis and implementation of geometric and graph algorithms";"5";29000;29000;2011
"Mahmoud, Qusay QH";"Computing and Information Science, School of";"Guelph";"RGPIN";"NetDNA: A middleware for seamless integration of devices, networks, and applications";"5";20000;20000;2011
"Maibaum, Thomas TSE";"Computing and Software";"McMaster";"RGPIN";"Software architecture, model driven development and fault tolerance";"5";42000;42000;2011
"Makarenkov, Vladimir V";"Informatique";"Quebec a Montreal";"RGPIN";"Methods and software for the analysis and classification of evolutionary and biomedical data";"5";42000;42000;2011
"Makaroff, Dwight DJ";"Computer Science";"Saskatchewan";"RGPIN";"Performance and security in parallel and distributed systems";"5";14000;14000;2011
"Marchand, Mario M";"Informatique et de genie logiciel";"Laval";"RGPIN";"PAC-Bayes learning and Kernel methods";"5";29000;29000;2011
"Martin, Patrick TP";"Computing, School of";"Queen's";"RGPIN";"Self managing cloud data services (SMCDS)";"5";29000;29000;2011
"Matwin, Stanislaw SJ";"Information Technology and Engineering, School of";"Ottawa";"RGPIN";"Research in machine learning and data privacy";"5";42000;42000;2011
"Mejri, Mohamed MM";"Informatique et de genie logiciel";"Laval";"RGPIN";"Renforcement formel et automatique de la securite informatique";"5";29000;29000;2011
"Mesbah, Ali A";"Electrical and Computer Engineering";"British Columbia";"RGPIN";"Web application testing as an automated service";"5";24000;24000;2011
"Mignotte, Max M";"Arts et des sciences, faculte des";"Montreal";"RGPIN";"Bayesian statistical fusion models based on constraints and multiple criteria in image processing and computer vision";"5";24000;24000;2011
"Miller, James J";"Electrical and Computer Engineering";"Alberta";"RGPIN";"Engineering internet-centric software systems";"5";33000;33000;2011
"Miller, Michael DM";"Computer Science";"Victoria";"RGPIN";"Synthesis and optimization of reversible and emerging technology circuits";"5";14000;14000;2011
"Moha, Naouel N";"Informatique";"Quebec a Montreal";"RGPIN";"Antipattern-based approach for service oriented design and quality improvement";"5";20000;20000;2011
"Mori, Gregory GP";"Computing Science";"Simon Fraser";"RGPIN";"Recognizing human figures and actions";"5";42000;42000;2011
"Moura, Lucia L";"Information Technology and Engineering, School of";"Ottawa";"RGPIN";"Combinatorial and algorithmic aspects of covering arrays for software and network testing";"5";24000;24000;2011
"Muller, Hausi HA";"Computer Science";"Victoria";"RGPIN";"Design and evolution of highly adaptive software systems: Context, control and run-time validation";"5";33000;33000;2011
"Nascimento, Mario MA";"Computing Science";"Alberta";"RGPIN";"Exploring context in spatio-temporal data";"5";29000;29000;2011
"Neustaedter, Carman CG";"Interactive Arts and Technology, School of (SIAT)";"Simon Fraser";"RGPIN";"Supporting awareness and interaction through domestic media spaces";"5";20000;20000;2011
"Neville, Stephen SW";"Electrical and Computer Engineering";"Victoria";"RGPIN";"Component-level virtual machines: A paradigm for achieving controllability in cloud-deployed dynamic distributed systems";"5";14000;14000;2011
"Ngom, Alioune A";"Computer Science, School of";"Windsor";"RGPIN";"High-order/variable-order dynamic Bayesian networks and dynamic qualitative probabilistic networks --- new models of gene regulatory networks";"5";14000;14000;2011
"Nickerson, Bradford BG";"Computer Science, Faculty of";"New Brunswick";"RGPIN";"Spatial data structures";"5";20000;20000;2011
"Osgood, Nathaniel ND";"Computer Science";"Saskatchewan";"RGPIN";"Stocking Hygeia's toolbox: methodological innovation in support of computational epidemiology";"5";14000;14000;2011
"Pan, Jianping J";"Computer Science";"Victoria";"RGPIN";"Protocol design and performance evaluation for network science and engineering";"5";24000;24000;2011
"Paquet, Joey J";"Computer Science and Software Engineering";"Concordia";"RGPIN";"Context-awareness and demand-driven evaluation in heterogeneous distributed systems";"5";20000;20000;2011
"Pei, Jian J";"Computing Science";"Simon Fraser";"RGPIN";"Towards context-aware data mining";"5";49000;49000;2011
"Peña Castillo, Lourdes MDL";"Computer Science";"Memorial Univ. of Nfld";"RGPIN";"Discovering gene regulatory networks through combination of diverse large-scale biological evidence";"5";14000;14000;2011
"Poole, David DL";"Computer Science";"British Columbia";"RGPIN";"Large scale reasoning under uncertainty";"5";29000;29000;2011
"Popowich, Frederick FP";"Computing Science";"Simon Fraser";"RGPIN";"Acceleration of real time natural language processing";"5";24000;24000;2011
"Pottinger, Rachel RA";"Computer Science";"British Columbia";"RGPIN";"Improving schema understandability for semantic integration";"5";24000;24000;2011
"Qiu, Ke K";"Computer Science";"Brock";"RGPIN";"Parallel computing on interconnection networks and for sequence analysis";"5";18000;18000;2011
"Quimper, Claude-Guy C-G";"Informatique et de genie logiciel";"Laval";"RGPIN";"Scheduling using constraint programming";"5";24000;24000;2011
"Rackoff, Charles CW";"Mathematical and Computational Sciences (Mississauga)";"Toronto";"RGPIN";"Topics in cryptography and computational complexity";"5";33000;33000;2011
"Robillard, Martin MP";"Computer Science, School of";"McGill";"RGPIN";"Automated support for framework documentation";"5";29000;29000;2011
"Ross, Brian BJ";"Computer Science";"Brock";"RGPIN";"Multi-objective grammar-guided genetic programming for bio-network modelling and evolutionary design";"5";14000;14000;2011
"Ruppert, Eric EO";"Computer Science and Engineering";"York";"RGPIN";"Algorithms and models for distributed systems";"5";24000;24000;2011
"Ruuth, Steven SJ";"Mathematics";"Simon Fraser";"RGPIN";"Algorithms for approximating continuum processes on surfaces";"5";33000;33000;2011
"Sack, Jorg-Rudiger JRW";"Computer Science, School of";"Carleton";"RGPIN";"Algorithms design for motion problems: theory & practice";"5";24000;24000;2011
"Sander, Jörg J";"Computing Science";"Alberta";"RGPIN";"Projected and semi-supervised clustering for high-dimensional data";"5";29000;29000;2011
"Scott, Philip PJ";"Mathematics and Statistics";"Ottawa";"RGPIN";"Polarized logics, geometry of interaction, and the dynamics of resource sensitive computation";"5";29000;29000;2011
"Shaw, Christopher CD";"Interactive Arts and Technology, School of (SIAT)";"Simon Fraser";"RGPIN";"Highly interactive visual analytics systems";"5";24000;24000;2011
"Singh, Karan K";"Computer Science";"Toronto";"RGPIN";"Sculpt and sketch interfaces for 3D modeling";"5";33000;33000;2011
"Skillicorn, David DB";"Computing, School of";"Queen's";"RGPIN";"Adversarial knowledge discovery";"5";29000;29000;2011
"Sodan, Angela ACC";"Computer Science, School of";"Windsor";"RGPIN";"Time- and space-adaptive parallel job sceduling for HPC servers, grids, and clouds";"5";24000;24000;2011
"Sokolova, Marina ML";"Medicine, Faculty of";"Ottawa";"RGPIN";"Learning health information from user-generated Web content";"5";14000;14000;2011
"Soltys-Kulinicz, Michael M";"Computing and Software";"McMaster";"RGPIN";"Proof complexity of matrix algebra";"5";24000;24000;2011
"Stege, Ulrike U";"Computer Science";"Victoria";"RGPIN";"Computational problems & tractable algorithms: Bridging the gap between problem definitions and solutions";"5";24000;24000;2011
"Stewart, Lorna LK";"Computing Science";"Alberta";"RGPIN";"Graph classes: Structure, algorithms, and complexity";"5";24000;24000;2011
"Stinson, Douglas DR";"Computer Science, David R. Cheriton School of";"Waterloo";"RGPIN";"Cryptography and cryptographic protocols";"5";49000;49000;2011
"Stumm, Michael M";"Electrical and Computer Engineering, Edward S. Rogers Sr. ";"Toronto";"RGPIN";"System software performance monitoring and optimization";"5";29000;29000;2011
"Szafron, Duane DA";"Computing Science";"Alberta";"RGPIN";"Using computer poker as a testbed for solving multiagent decision problems";"5";29000;29000;2011
"Taha, Abd-Elhamid AM";"Computing, School of";"Queen's";"RGPIN";"Opportunistic frameworks for radio resource management";"5";20000;20000;2011
"Talhi, Chamseddine C";"Genie logiciel et des TI";"Ecole de technologie superieure";"RGPIN";"Security enforcement for resource-constrained systems";"5";14000;14000;2011
"Ternovska, Eugenia EA";"Computing Science";"Simon Fraser";"RGPIN";"Model expansion as a framework for representing and solving search and optimization problems";"5";29000;29000;2011
"Thomo, Alex AI";"Computer Science";"Victoria";"RGPIN";"Extracting intelligence from an interconnected world of data";"5";29000;29000;2011
"Thorpe, Julie JK";"Business and Information Technology, Faculty of";"Ontario Institute of Technology";"RGPIN";"Improving computer security through the analysis of human factors";"2";20000;20000;2011
"Thulasiraman, Parimala PS";"Computer Science";"Manitoba";"RGPIN";"Irregular computations on heterogeneous multi-core architectures";"5";14000;14000;2011
"Tsotsos, John JK";"Computer Science and Engineering";"York";"RGPIN";"Re-visiting Ullman's visual routines";"5";60300;60300;2011
"Turcotte, Marcel M";"Information Technology and Engineering, School of";"Ottawa";"RGPIN";"Development of bioinformatics tools for RNomics research";"3";14000;14000;2011
"Tzerpos, Vassilios V";"Computer Science and Engineering";"York";"RGPIN";"Software pattern detection";"5";24000;24000;2011
"Urquhart, Alasdair AIF";"Computer Science";"Toronto";"RGPIN";"Logic and computational complexity";"5";29000;29000;2011
"Vaikuntanathan, Vinod V";"Mathematical and Computational Sciences (Mississauga)";"Toronto";"RGPIN";"cryptography in highly adversarial enviroments";"5";29000;29000;2011
"Vassilev, Tzvetalin TS";"Computer Science";"Nipissing";"RGPIN";"Optimization problems on geometric graphs";"5";14000;14000;2011
"Vassileva, Julita JI";"Computer Science";"Saskatchewan";"RGPIN";"Designing social infrastructures encouraging behaviour change and participation through personalized incentives";"5";59243;59243;2011
"Vidyasankar, Krishnamurthy K";"Computer Science";"Memorial Univ. of Nfld";"RGPIN";"Atomicity and consistency issues in service composition and transactional memory";"5";20000;20000;2011
"Von Bochmann, Gregor G";"Engineering, Faculty of";"Ottawa";"RGPIN";"Software development for distributed applications and scalable execution platforms";"5";29000;29000;2011
"Wachowiak, Mark MP";"Arts and Science, Faculty of";"Nipissing";"RGPIN";"High-performance global optimization and signal processing on multicore, GPU, and hybrid architectures";"5";14000;14000;2011
"Wakkary, Ron R";"Interactive Arts and Technology, School of (SIAT)";"Simon Fraser";"RGPIN";"Improving design strategies for customization and appropriation";"5";20000;20000;2011
"Wang, Hai H";"Finance, Information Systems, and Management Science";"Saint Mary's";"RGPIN";"Data summarization on probabilistic databases";"5";20000;20000;2011
"Weddell, Grant GE";"Computer Science, David R. Cheriton School of";"Waterloo";"RGPIN";"Integrating and querying information sources in the context of large-scale ontological knowledge";"5";24000;24000;2011
"Wei, Ruizhong R";"Computer Science";"Lakehead";"RGPIN";"Combinatorial methods in network security and communication codes";"5";24000;24000;2011
"Whitehead, Anthony AD";"Information Technology, School of";"Carleton";"RGPIN";"Personal space sensor networks for active human computer interaction";"5";14000;14000;2011
"Whitesides, Sue S";"Computer Science";"Victoria";"RGPIN";"Robotics and geometry";"5";33000;33000;2011
"Wigdor, Daniel DJ";"Computer and Mathematical Sciences";"Toronto";"RGPIN";"User interface feedforward and feedback supporting and enabling body tracking technologies";"5";29000;29000;2011
"Wismath, Stephen SK";"Mathematics and Computer Science";"Lethbridge";"RGPIN";"Algorithmic graph drawing";"5";14000;14000;2011
"Woodside, Murray CM";"Systems and Computer Engineering";"Carleton";"RGPIN";"Software performance engineering by models and measurement";"5";42000;42000;2011
"Woungang, Isaac I";"Computer Science";"Ryerson";"RGPIN";"Attacks and defense in mobile wireless ad hoc networks";"5";14000;14000;2011
"Wyvill, Brian BLM";"Computer Science";"Victoria";"RGPIN";"Interactive implicit modelling";"5";33000;33000;2011
"Xiang, Yang Y";"Computing and Information Science, School of";"Guelph";"RGPIN";"Graphical models: Inference, decision and acquisition";"5";14000;14000;2011
"Xiao, Lu LX";"Information and Media Studies, Faculty of";"Western Ontario";"RGPIN";"The value of visualizing shared rationales for identifying hidden profiles in virtual group decision-making";"5";14000;14000;2011
"Ye, Qiang Q";"Computer Science and Information Technology";"Prince Edward Island";"RGPIN";"QoS provisioning in heterogeneous networks: A perspective from the edge";"5";14000;14000;2011
"Young, James JE";"Computer Science";"Manitoba";"RGPIN";"Leveraging people's everyday skill sets for interaction with robots";"5";14000;14000;2011
"Zhang, Chang-Nian CN";"Computer Science";"Regina";"RGPIN";"Fault tolerant cryptography and advanced multilayer access control";"5";14000;14000;2011
"Zhang, Hong H";"Computing Science";"Alberta";"RGPIN";"Scalable appearance-based robot navigation";"5";24000;24000;2011
"Zouaq, Amal A";"Mathematics and Computer Science";"Royal Military College of Canada";"RGPIN";"A learning-by-reading framework for ontology learning";"5";14000;14000;2011
"Abdulrazak, Bessam BA";"Informatique";"Sherbrooke";"RGPIN";"Adaptable Smart Environments for Elderly People  [Environnement Intelligent Adaptable pour les Personnes Agées]";"5";22000;2012
"Alhajj (Elhajj), Reda RA";"Computer Science";"Calgary";"RGPIN";"Employing Data Mining and Machine Learning Techniques for Social Network Modeling and Analysis";"1";14000;2012
"Amza, Cristiana C";"Electrical and Computer Engineering, Edward S. Rogers Sr. Department of";"Toronto";"RGPIN";"Chorus: A Resource Management Framework for Cost Effective Quality of Service in Cloud Environments";"5";28000;2012
"Andrews, James H";"Computer Science";"Western Ontario";"RGPIN";"Testing and Debugging: Connecting Research with Practice";"5";28000;2012
"Arnold, Dirk DV";"Computer Science, Faculty of";"Dalhousie";"RGPIN";"Constraint handling in evolutionary algorithms";"5";17000;2012
"Atlee, Joanne JM";"Computer Science, David R. Cheriton School of";"Waterloo";"RGPIN";"Modelling and Analysis of Feature-Oriented Software";"5";34000;2012
"Aubanel, Eric E A";"Computer Science, Faculty of";"New Brunswick";"RGPIN";"Parallel Heterogeneous Algorithms for Computational Science";"5";14000;2012
"Balakrishnan, Ravin R";"Computer Science";"Toronto";"RGPIN";"User Interfaces and Visualization for Variable Format Displays.";"5";52000;2012
"Baniasadi, Amirali A";"Electrical and Computer Engineering";"Victoria";"RGPIN";"Power-Aware Multicore Processing";"5";22000;2012
"Banzhaf, Wolfgang WD";"Computer Science";"Memorial Univ. of Nfld";"RGPIN";"From Genetic Programming to Computational Evolution";"5";34000;2012
"Barron, John JL";"Computer Science";"Western Ontario";"RGPIN";"The Measurement and Interpretation of 2D and 3D Image Motion";"5";14000;2012
"Bartram, Linda (Lyn) LR";"Interactive Arts and Technology, School of (SIAT)";"Simon Fraser";"RGPIN";"Ambient and Ubiquitous Visualization for Sustainability";"5";14000;2012
"Beaudry, Eric E";"Informatique";"Quebec a Montreal";"RGPIN";"Algorithmes de planification appliques aux jeux serieux";"5";19000;2012
"Bener, Ayse AB";"Information and Technology Management, School of (ITM)";"Ryerson";"RGPIN";"Decision Making under Uncertainty in Software Engineering: Release Readiness";"5";28000;2012
"Bentahar, Jamal J";"Concordia Institute for Information Systems Engineering (CIISE)";"Concordia";"RGPIN";"Intelligent, Strategic and Verifiable Agent-based Communities of Web Services: Theoretical Foundations and Automation";"5";28000;2012
"Berenbrink, Petra P";"Computing Science, School of";"Simon Fraser";"RGPIN";"Randomized Algorithms for Distributed Systems";"5";42000;2012
"Bhavsar, Virendrakumar VC";"Computer Science, Faculty of";"New Brunswick";"RGPIN";"Parallel and Distributed Intelligent Systems";"5";14000;2012
"Bonakdarpour, Borzoo B";"Computer Science, David R. Cheriton School of";"Waterloo";"RGPIN";"Automated Construction of Dependable Component-based Cyber-physical Models";"5";27000;2012
"Bonner, Anthony AJB";"Computer Science";"Toronto";"RGPIN";"Computational Methods for Detecting Multi-gene Relationships in Gene Expression Data";"5";17000;2012
"Borodin, Allan B";"Computer Science";"Toronto";"RGPIN";"Design, analysis and theory of algorithms";"5";74000;2012
"Boufama, Boubakeur S";"Computer Science, School of";"Windsor";"RGPIN";"Semantic Structure from Multiple Uncalibrated Images";"5";14000;2012
"Bouguila, Nizar N";"Concordia Institute for Information Systems Engineering (CIISE)";"Concordia";"RGPIN";"Apprentissage statistique hybride (generatif/discriminatif) de modèles multi-relationnels dynamiques et Applications";"5";28000;2012
"Boulanger, Pierre PB";"Computing Science";"Alberta";"RGPIN";"TEMIS-Training Environments for Minimally Invasive Surgery";"1";17000;2012
"Bouzouane, Abdenour A";"Informatique-mathematique";"Quebec a Chicoutimi";"RGPIN";"Fouille de donnees spatio-temporelles et multidimensionnelles pour la reconnaissance d'activites: habitat intelligent";"5";14000;2012
"Bowling, Michael MH";"Computing Science";"Alberta";"RGPIN";"Human-Scale Game Theory in Imperfect Information Settings";"5";42000;2012
"Boykov, Yuri YY";"Computer Science";"Western Ontario";"RGPIN";"Combinatorial Optimization Methods for Computer Vision and Bio-medical Image Analysis";"5";42000;2012
"Brecht, Timothy B";"Computer Science, David R. Cheriton School of";"Waterloo";"RGPIN";"Evolving the HTTP Ecosystem to Efficiently Support Video and other Large Files";"5";28000;2012
"Buro, Michael M";"Computing Science";"Alberta";"RGPIN";"Search, Opponent Modelling, Cooperation, and State Inference in Complex Imperfect Information Domains.";"5";17000;2012
"Butz, Cory J";"Computer Science";"Regina";"RGPIN";"Identifying, Understanding, and Exploiting Semantics During Exact Inference in Discrete Bayesian Networks";"5";14000;2012
"Carenini, Giuseppe G";"Computer Science";"British Columbia";"RGPIN";"Integrating Methods for Mining and Summarizing Text Conversations";"5";14000;2012
"Carette, Jacques JLSJ";"Computing and Software";"McMaster";"RGPIN";"Disciplined Meta-Programming";"5";22000;2012
"Carpendale, Sheelagh MST";"Computer Science";"Calgary";"RGPIN";"Interactive Visualization";"5";62000;2012
"Chang, Xiao-Wen XW";"Computer Science, School of";"McGill";"RGPIN";"Algorithms, Analysis, Applications and Software of Numerical Linear Algebra";"5";22000;2012
"Chen, Yangjun YC";"Applied Computer Science";"Winnipeg";"RGPIN";"Reachability Queries and Graph Pattern Queries in Graph Databases";"5";14000;2012
"Cheng, Howard Chi Ho HCH";"Mathematics and Computer Science";"Lethbridge";"RGPIN";"Space-efficient algorithms in computer algebra and image processing applications";"5";17000;2012
"Cherkaoui, Omar O";"Informatique";"Quebec a Montreal";"RGPIN";"Optimal resource allocation of virtualized router: a multi-objective approach";"5";17000;2012
"Chiasson, Sonia SA";"Computer Science, School of";"Carleton";"RGPIN";"Universal Usable Security";"5";22000;2012
"Corbo, Jacomo J";"Telfer School of Management";"Ottawa";"RGPIN";"Information Network Flows and Social and Economic Outcomes: Models, Prediction, and Regulation";"5";19000;2012
"Cordy, James J R";"Computing, School of";"Queen's";"RGPIN";"Software Analysis and Transformation Systems";"5";42000;2012
"Czarnecki, Krzysztof K";"Electrical & Computer Engineering";"Waterloo";"RGPIN";"Lightweight Modeling to Improve Requirements Engineering of Enterprise Software";"5";42000;2012
"Dahl, Veronica VD";"Computing Science, School of";"Simon Fraser";"RGPIN";"Constraint Solving for Language Processing and Bioinformatics";"5";14000;2012
"de Freitas, Joao (Nando) JFGF";"Computer Science";"British Columbia";"RGPIN";"Feature learning";"5";52000;2012
"de Lara, Eyal E";"Computer Science";"Toronto";"RGPIN";"System Support for Next Generation Cloud Computing";"5";34000;2012
"Dean, Thomas TR";"Electrical and Computer Engineering";"Queen's";"RGPIN";"Language Based Software Engineering for Large Web Based Systems";"5";17000;2012
"Debbabi, Mourad M";"Concordia Institute for Information Systems Engineering (CIISE)";"Concordia";"RGPIN";"Aspect-Oriented Security Hardening of Design Models";"5";34000;2012
"Delgrande, James JP";"Computing Science, School of";"Simon Fraser";"RGPIN";"Belief change in rational agents (with application to action formalisms, ontologies, and inferentially weak systems)";"5";42000;2012
"Demke-Brown, Angela AKD";"Computer Science";"Toronto";"RGPIN";"Dr. OS: Operating system analysis, debugging and security tools based on dynamic binary translation";"5";28000;2012
"Desharnais, Josee J";"Informatique et de genie logiciel";"Laval";"RGPIN";"Duality, approximations and distances for probabilistic processes";"5";28000;2012
"Desharnais, Jules J";"Informatique et de genie logiciel";"Laval";"RGPIN";"Domain algebra, quantum algebra, refinement algebra";"5";28000;2012
"Desmarais, Michel MC";"Genie informatique et genie logiciel";"Ecole Polytechnique";"RGPIN";"Algorithms and Applications of Learned Student Models for Adaptive Learning Systems";"5";34000;2012
"Dick, Scott SH";"Electrical and Computer Engineering";"Alberta";"RGPIN";"Novel developments in computational intelligence with applications to data stream mining";"5";22000;2012
"Doedel, Eusebius EJ";"Computer Science and Software Engineering";"Concordia";"RGPIN";"Numerical Analysis of Bifurcation Problems";"5";42000;2012
"Drew, Mark MS";"Computing Science, School of";"Simon Fraser";"RGPIN";"Physics-based colour models in computer vision, colour science, graphics and multimedia";"5";34000;2012
"Dutchyn, Christopher CJ";"Computer Science";"Saskatchewan";"RGPIN";"Rigorous Modularity: formalizing and verifying software constructions";"5";14000;2012
"El-Khatib, Khalil K";"Business and Information Technology, Faculty of";"Ontario Institute of Technology";"RGPIN";"Securing the Next-Generation Smart Electric Grid";"5";17000;2012
"Ellis, Randy RE";"Computing, School of";"Queen's";"RGPIN";"Computational Models For Surgical Navigation";"5";42000;2012
"Ester, Martin M";"Computing Science, School of";"Simon Fraser";"RGPIN";"Probabilistic Graphical Models for Data Mining and Recommendation in Social Media";"5";34000;2012
"Fedorova, Alexandra A";"Computing Science, School of";"Simon Fraser";"RGPIN";"Eliminating energy waste in memory systems by improving the software";"5";22000;2012
"Franek, Frantisek F";"Computing and Software";"McMaster";"RGPIN";"Computational and combinatorial approaches to periodicities in strings";"5";14000;2012
"Friedman, Joel J";"Computer Science";"British Columbia";"RGPIN";"Expanders and Related Topics";"5";28000;2012
"Ganjali, Yashar Y";"Computer Science";"Toronto";"RGPIN";"Control and Management for Next Generation Networks";"5";22000;2012
"Garcia, Ronald R";"Computer Science";"British Columbia";"RGPIN";"Enhancing Support for Metaprogramming";"5";22000;2012
"Glitho, Roch RH";"Concordia Institute for Information Systems Engineering (CIISE)";"Concordia";"RGPIN";"Application and Service Architectures for Machine-to-Machine (M2M) Communications";"5";28000;2012
"Goel, Ashvin A";"Electrical and Computer Engineering, Edward S. Rogers Sr. Department of";"Toronto";"RGPIN";"End-to-End Data Reliability with Runtime Verification";"5";22000;2012
"Golab, Lukasz L";"Management Sciences";"Waterloo";"RGPIN";"Characterizing and Improving Data Quality in Very Large Databases";"5";28000;2012
"Goldberg, Ian IA";"Computer Science, David R. Cheriton School of";"Waterloo";"RGPIN";"Privacy-enhanced protocols for Internet transactions";"5";34000;2012
"Gong, Minglun M";"Computer Science";"Memorial Univ. of Nfld";"RGPIN";"Computer vision algorithms for live video processing using programmable graphics hardware";"5";22000;2012
"Gooch, Amy A";"Computer Science";"Victoria";"RGPIN";"Framework for Preserving Salience through Perceptual Differences in Spectral Image Creation and Manipulation: From Scene to Display";"5";17000;2012
"Gopalakrishnan, Sathish S";"Electrical and Computer Engineering";"British Columbia";"RGPIN";"Enabling adaptation in embedded and real-time systems";"5";28000;2012
