"Name";"Deparment";"Institution";"Program";"Title";"Term";"amount"
"Precup, Doina D";"Computer Science, School of";"McGill";"RGPIN";"Developmental reinforcement learning";"5";"$60,000.00";60000;2010
"Privat, Jean J";"Informatique";"Quebec a Montreal";"RGPIN";"A object-oriented programming language for robust software";"5";"$15,000.00";15000;2010
"Rappaport, David DH";"Computing, School of";"Queen's";"RGPIN";"Computational geometry and data analysis";"5";"$25,000.00";25000;2010
"Ray, Nilanjan N";"Computing Science";"Alberta";"RGPIN";"Feature correspondence for image analysis";"5";"$25,000.00";25000;2010
"Rayside, Derek DF";"Electrical & Computer Engineering";"Waterloo";"RGPIN";"Programming with specifications";"5";"$15,000.00";15000;2010
"Reformat, Marek M";"Electrical and Computer Engineering";"Alberta";"RGPIN";"Fuzziness and context-awareness in decision-making schemas for semantic web";"5";"$20,000.00";20000;2010
"Rilling, Juergen JE";"Computer Science and Software Engineering";"Concordia";"RGPIN";"Ambient software engineering";"5";"$25,000.00";25000;2010
"Roy, Chanchal Kumar CK";"Computer Science";"Saskatchewan";"RGPIN";"Change, similarity and redundancy in software systems";"5";"$15,000.00";15000;2010
"Sadaoui, Samira S";"Computer Science";"Regina";"RGPIN";"Trust management and matchmaking system for multi-attribute reverse auctions";"5";"$20,000.00";20000;2010
"Sahinalp, Cenk CS";"Computing Science";"Simon Fraser";"RGPIN";"Bioinformatics algorithms- from sequence to structure and function";"5";"$43,000.00";43000;2010
"Salah, Aziz A";"Informatique";"Quebec a Montreal";"RGPIN";"Service management system: protocol similarity search";"5";"$15,000.00";15000;2010
"Schost, Eric E";"Computer Science";"Western Ontario";"RGPIN";"Efficient algorithms in computer algebra and their applications";"5";"$43,000.00";43000;2010
"Sedig, Kamran K";"Computer Science";"Western Ontario";"RGPIN";"Design of cognitive tools for everyday information-based activities";"5";"$15,000.00";15000;2010
"Shakshuki, Elhadi ES";"Computer Science, Jodrey School of";"Acadia";"RGPIN";"Cooperative intelligent distributed systems for context-aware and calendaring system";"5";"$15,000.00";15000;2010
"Shepherd, Bruce BF";"Mathematics and Statistics";"McGill";"RGPIN";"Polyhedral methods for optimization and algorithm design";"5";"$31,000.00";31000;2010
"Shepherd, Michael MA";"Computer Science, Faculty of";"Dalhousie";"RGPIN";"Context-aware web retrieval";"5";"$15,000.00";15000;2010
"Shiri-Varnaamkhaasti, Nematollaah N";"Computer Science and Software Engineering";"Concordia";"RGPIN";"High performance time series data analysis and pattern discovery";"1";"$15,000.00";15000;2010
"Shoja, Gholamali GC";"Computer Science";"Victoria";"RGPIN";"Leveraging social network theories to address data delivery issues in mobile ad hoc networks";"5";"$15,000.00";15000;2010
"Singh, Mohit M";"Computer Science, School of";"McGill";"RGPIN";"New techniques and directions in approximation algorithms";"5";"$31,000.00";31000;2010
"Smyth, Tamara TR";"Computing Science";"Simon Fraser";"RGPIN";"Modeling, extension, and parameter identification/estimation of vocal and musical instrument systems";"5";"$15,000.00";15000;2010
"Stewart, Neil NF";"Informatique et recherche operationnelle";"Montreal";"RGPIN";"Robustness of subdivision-surface methods";"5";"$20,000.00";20000;2010
"Stojmenovic, Ivan I";"Information Technology and Engineering, School of";"Ottawa";"RGPIN";"Data communication in wireless ad hoc, sensor and vehicular networks";"5";"$31,000.00";31000;2010
"Storey, Margaret-Anne M-AD";"Computer Science";"Victoria";"RGPIN";"Understanding the role of web 2.0 and social media in collaborative software development";"5";"$43,000.00";43000;2010
"Tahar, Sofiene SO";"Electrical and Computer Engineering";"Concordia";"RGPIN";"Formal verification of physical systems and devices";"5";"$51,000.00";51000;2010
"Tan, Lin L";"Electrical & Computer Engineering";"Waterloo";"RGPIN";"Leveraging software semantic information to improve software reliability";"5";"$20,000.00";20000;2010
"Tawbi, Nadia N";"Informatique et de genie logiciel";"Laval";"RGPIN";"Security policy enforcement mechanisms";"5";"$31,000.00";31000;2010
"Thulasiram, Ruppa RK";"Computer Science";"Manitoba";"RGPIN";"Advances in computational finance and its application in grid computing";"5";"$15,000.00";15000;2010
"Tompa, Frank FW";"Computer Science, David R. Cheriton School of";"Waterloo";"RGPIN";"Flexible, efficient text databases";"5";"$31,000.00";31000;2010
"Tourlakis, George G";"Computer Science and Engineering";"York";"RGPIN";"Calculational logic";"5";"$15,000.00";15000;2010
"Turksen, Burhan IB";"Mechanical and Industrial Engineering";"Toronto";"RGPIN";"Computing with words for decision making under uncertainty";"5";"$20,000.00";20000;2010
"Van de Panne, Michiel M";"Computer Science";"British Columbia";"RGPIN";"Scalable physics-based modeling of skilled movement";"5";"$34,000.00";34000;2010
"Vangheluwe, Hans HLM";"Computer Science, School of";"McGill";"RGPIN";"Modelling and simulation based design";"5";"$31,000.00";31000;2010
"Vaughan, Richard RT";"Computing Science";"Simon Fraser";"RGPIN";"Energy efficient large scale multi-robot systems";"5";"$25,000.00";25000;2010
"Vuong, Son ST";"Computer Science";"British Columbia";"RGPIN";"IAMNET - An intelligent AMbient NETworks for the internet of things";"5";"$31,000.00";31000;2010
"Wagner, Alan Shelton AS";"Computer Science";"British Columbia";"RGPIN";"Data intensive parallel computing";"5";"$20,000.00";20000;2010
"Wainer, Gabriel GA";"Systems and Computer Engineering";"Carleton";"RGPIN";"Methodologies for real-time discrete-event simulation";"5";"$31,000.00";31000;2010
"Waldispuhl, Jerome J";"Computer Science, School of";"McGill";"RGPIN";"Algorithms for exploring the mutational landscape of RNA molecules";"5";"$25,000.00";25000;2010
"Wan, Justin JWL";"Computer Science, David R. Cheriton School of";"Waterloo";"RGPIN";"Numerical models and methods for cell image analysis";"5";"$25,000.00";25000;2010
"Wang, Fangju F";"Computing and Information Science";"Guelph";"RGPIN";"Disambiguation in natural language user interfaces of service robots";"5";"$15,000.00";15000;2010
"Wang, Shengrui S";"Informatique";"Sherbrooke";"RGPIN";"Mining high-dimensional data, sequences and data streams / Prospection de donnees de grande dimension, de sequences et de flux de donees";"5";"$43,000.00";43000;2010
"Wareham, Harold HT";"Computer Science";"Memorial Univ. of Nfld";"RGPIN";"Parameterized complexity analysis in cognitive science";"5";"$15,000.00";15000;2010
"Wasserman, Wyeth WW";"Medical Genetics";"British Columbia";"RGPIN";"Computational analysis of regulatory DNA sequences controlling gene transcription";"5";"$35,700.00";35700;2010
"Wineberg, Mark ML";"Computing and Information Science";"Guelph";"RGPIN";"Modeling evolutionary algorithms for dynamic and stochastic optimization";"5";"$15,000.00";15000;2010
"Witte, Rene R";"Computer Science and Software Engineering";"Concordia";"RGPIN";"Natural language processing services for semantic computing";"5";"$15,000.00";15000;2010
"Wohlstadter, Eric EA";"Computer Science";"British Columbia";"RGPIN";"Optimization of distributed data access for web applications";"5";"$15,000.00";15000;2010
"Wu, Fang Xiang FX";"Mechanical Engineering";"Saskatchewan";"RGPIN";"Development of methodologies for modeling and design molecular biological systems";"5";"$20,000.00";20000;2010
"Yeh, Chi-Hsiang CH";"Electrical and Computer Engineering";"Queen's";"RGPIN";"Green wireless internet: architectures, protocols, applications, and implementations";"5";"$25,000.00";25000;2010
"Yoon, Tae Jin TJ";"Linguistics and Languages";"McMaster";"RGPIN";"Prosodic phrasing detection using acoustic source characteristics";"5";"$15,000.00";15000;2010
"You, Jia-Huai JH";"Computing Science";"Alberta";"RGPIN";"Answer set programming and applications";"5";"$25,000.00";25000;2010
"Zhang, Hao H";"Computing Science";"Simon Fraser";"RGPIN";"Towards high-level geometry processing in computer graphics";"5";"$31,000.00";31000;2010
"Zhang, Yang Y";"Mathematics";"Manitoba";"RGPIN";"Noncommutative structures in computer algebra";"5";"$20,000.00";20000;2010
"Zilles, Sandra S";"Computer Science";"Regina";"RGPIN";"Algorithmic learning theory and typed pattern languages";"5";"$31,000.00";31000;2010
"Abdel-Dayem, Amr AAR";"Mathematics and Computer Science";"Laurentian";"RGPIN";"Image segmentation and understanding";"5";14000;14000;2011
"Abran, Alain A";"Genie logiciel et des TI";"Ecole de technologie superieure";"RGPIN";"Software metrology: Foundations, concepts and techniques for improving quantitative management in software engineering";"5";24000;24000;2011
"Adi, Kamel K";"Informatique et d'ingenierie";"Quebec en Outaouais";"RGPIN";"Securite des systèmes et reseaux informatiques";"5";24000;24000;2011
"Ahmed, Maher MM";"Physics and Computer Science";"Wilfrid Laurier";"RGPIN";"Multiple sensors system for sign language recognition";"5";14000;14000;2011
"Alhajj, Reda RS";"Computer Science";"Calgary";"RGPIN";"The power of data mining and machine leaning techniques in social network modeling and analysis";"1";20000;20000;2011
"Andrews, James JH";"Computer Science";"Western Ontario";"RGPIN";"Development of high-quality, accessible software";"5";20000;20000;2011
"Ansermino, Mark MJ";"Medicine, Faculty of";"British Columbia";"RGPIN";"The monitoring messenger: Mobile patient monitoring for the intensive care unit";"1";24000;24000;2011
"Antle, Alissa AN";"Interactive Arts and Technology, School of (SIAT)";"Simon Fraser";"RGPIN";"Image schema and conceptual metaphor based whole body user interfaces";"5";14000;14000;2011
"Antoniol, Giuliano G";"Genie informatique et genie logiciel";"Ecole Polytechnique";"RGPIN";"Textual information driven software quality improvement";"5";29000;29000;2011
"Arazy, Ofer O";"Business, School of";"Alberta";"RGPIN";"Theory-driven design for collaborative information technology";"1";14000;14000;2011
"Ascher, Uri UM";"Computer Science";"British Columbia";"RGPIN";"Numerical simulation of surface reconstruction, inverse problems and differential equations in applications";"5";33000;33000;2011
"Atwood, John (Bill) JW";"Computer Science and Software Engineering";"Concordia";"RGPIN";"Secure and accountable multicast data distribution";"5";29000;29000;2011
"Bacchus, Fahiem FI";"Computer Science";"Toronto";"RGPIN";"Improving the impact and effectiveness of solvers for complete problems";"5";42000;42000;2011
"Baltes, Hansjorg (Jacky) H";"Computer Science";"Manitoba";"RGPIN";"Active balancing and complex motion planning for adult sized humanoid robots";"5";14000;14000;2011
"Basu, Anup A";"Computing Science";"Alberta";"RGPIN";"Perceptually and probabilistically guided multimedia";"5";33000;33000;2011
"Beauchemin, Steven S";"Computer Science";"Western Ontario";"RGPIN";"RoadLab: An investigation of predictive driver behaviour models for road safety";"5";14000;14000;2011
"Bertossi, Leopoldo LE";"Computer Science, School of";"Carleton";"RGPIN";"Contexts as metadata for data management";"5";29000;29000;2011
"Bhattacharya, Binay BK";"Computing Science";"Simon Fraser";"RGPIN";"Design and analysis of efficient algorithms for location-routing problems";"5";24000;24000;2011
"Bodorik, Peter P";"Computer Science, Faculty of";"Dalhousie";"RGPIN";"Towards the design of correct, scalable, and interoperable caching algorithms";"5";14000;14000;2011
"Boley, Harold H";"Computer Science, Faculty of";"New Brunswick";"RGPIN";"Metrics-controlled Web rule translation";"5";24000;24000;2011
"Booth, Kellogg KS";"Computer Science";"British Columbia";"RGPIN";"Collaboration technology and multi-user interfaces";"5";42000;42000;2011
"Bouchard-Cote, Alexandre A";"Statistics";"British Columbia";"RGPIN";"Next generation phylogenetic modelling using machine learning";"5";24000;24000;2011
"Boucheneb, Hanifa HB";"Genie informatique et genie logiciel";"Ecole Polytechnique";"RGPIN";"Vers l'integration de methodes formelles dans le processus de developpement de systèmes temps reel complexes";"5";24000;24000;2011
"Bouguessa, Mohamed M";"Informatique";"Sherbrooke";"RGPIN";"Knowledge discovery from online social network";"5";20000;20000;2011
"Burkowski, Forbes FJ";"Computer Science, David R. Cheriton School of";"Waterloo";"RGPIN";"Using distance geometry algorithms to derive molecular conformational ensembles";"5";14000;14000;2011
"Burton-Jones, Andrew AN";"Sauder School of Business";"British Columbia";"RGPIN";"Expanding conceptual models used in information systems analysis with temporal concepts";"1";14000;14000;2011
"Capretz, Miriam AM";"Electrical and Computer Engineering";"Western Ontario";"RGPIN";"Maintenance and evolution of service oriented architecture";"5";20000;20000;2011
"Cercone, Nick NJ";"Computer Science and Engineering";"York";"RGPIN";"Integrated methodologies (machine learning, data analysis, natural language) and their use in health/language applications and assistive technologies for people with disabilities";"5";24000;24000;2011
"Chali, Yllias Y";"Mathematics and Computer Science";"Lethbridge";"RGPIN";"Inferencing and synthesizing information from multiple documents using text summarization and question answering models";"5";20000;20000;2011
"Chan, Christine CW";"Engineering, Faculty of";"Regina";"RGPIN";"Development of a method for ontology-driven knowledge engineering and its application to the greywater reclamation system";"5";20000;20000;2011
"Chen, Liang L";"Computer Science";"Northern British Columbia";"RGPIN";"Theory of electoral college framework-based multi-classifier ensembling and its applications to subjective pattern recognition";"5";14000;14000;2011
"Cobzas, Dana D";"Computing Science";"Alberta";"RGPIN";"A diffusion-based statistical shape model for medical image analysis";"5";14000;14000;2011
"Cohen, Robin R";"Computer Science, David R. Cheriton School of";"Waterloo";"RGPIN";"Trust and social networking of multiagent peers";"5";20000;20000;2011
"Condon, Anne AE";"Computer Science";"British Columbia";"RGPIN";"Prediction and design of nucleic acid secondary structure and folding pathways: from theory to tools";"5";49000;49000;2011
"Cook, Stephen SA";"Computer Science";"Toronto";"RGPIN";"Computational complexity and logic";"5";96000;96000;2011
"Cormack, Gordon GV";"Computer Science, David R. Cheriton School of";"Waterloo";"RGPIN";"Evaluation and improvement of search tools for critical information";"5";24000;24000;2011
"Corneil, Derek DG";"Computer Science";"Toronto";"RGPIN";"Algorithmic graph theory";"5";33000;33000;2011
"Costa Sousa, Mario M";"Computer Science";"Calgary";"RGPIN";"Interactive context-aware illustrative visualization";"5";29000;29000;2011
"Csuros, Miklos M";"Informatique et recherche operationnelle";"Montreal";"RGPIN";"Bioinformatics for comparative and evolutionary genomics";"5";24000;24000;2011
"Czyzowicz, Jurek J";"Informatique et d'ingenierie";"Quebec en Outaouais";"RGPIN";"Mobile agents algorithms for networks and geometric environments";"5";24000;24000;2011
"Dehne, Frank FK";"Computer Science, School of";"Carleton";"RGPIN";"Auto-tuned parallel algorithms for hybrid multi-core/many-core processor clusters";"5";49000;49000;2011
"Devroye, Luc L";"Computer Science, School of";"McGill";"RGPIN";"Applications of probability theory in the design and analysis of algorithms";"5";85000;85000;2011
"Dimitrov, Vasil VS";"Electrical and Computer Engineering";"Calgary";"RGPIN";"Side channel protection of public key cryptographic systems";"1";20000;20000;2011
"Dssouli, Rachida R";"Concordia Institute for Information Systems Engineering (CIISE)";"Concordia";"RGPIN";"Dynamic composition of systems and services";"5";20000;20000;2011
"Dujmovic, Vida V";"Computer Science, School of";"Carleton";"RGPIN";"Geometric representation of graphs and graph minors";"5";29000;29000;2011
"Duntsch, Ivo IV";"Computer Science";"Brock";"RGPIN";"Reasoning about perceptual systems";"5";20000;20000;2011
"Eager, Derek DL";"Computer Science";"Saskatchewan";"RGPIN";"The design and performance analysis of internet systems and applications";"5";29000;29000;2011
"Edmonds, Jeff A";"Computer Science and Engineering";"York";"RGPIN";"Multi-processor scheduling and power management";"5";14000;14000;2011
"Egli, Richard RP";"Informatique";"Sherbrooke";"RGPIN";"Meshfree physically-based animation of natural phenomena in computer graphics";"5";20000;20000;2011
"El Boussaidi, Ghizlane G";"Genie logiciel et des TI";"Ecole de technologie superieure";"RGPIN";"Software design through model transformation";"5";14000;14000;2011
"El Emam, Khaled KM";"Pediatrics";"Ottawa";"RGPIN";"Metrics and methods for the de-identification of health information";"5";29000;29000;2011
"El-Sakka, Mahmoud MR";"Computer Science";"Western Ontario";"RGPIN";"Model-based image segmentation";"5";24000;24000;2011
"Enright, Wayne WH";"Computer and Mathematical Sciences";"Toronto";"RGPIN";"Robust and reliable software for the investigation of approximate solutions of systems of ordinary differential equations";"5";20000;20000;2011
"Esfandiari, Babak BE";"Systems and Computer Engineering";"Carleton";"RGPIN";"User imitation for multi-purpose robotics";"5";14000;14000;2011
"Evans, William WS";"Computer Science";"British Columbia";"RGPIN";"Impact of information representation on computation";"5";24000;24000;2011
"Ezeife, Christie CI";"Computer Science, School of";"Windsor";"RGPIN";"Mining informative patterns from the Web, object-oriented and multiple data sources";"5";20000;20000;2011
"Feeley, Michael MJ";"Computer Science";"British Columbia";"RGPIN";"System support for distributed, reliable and personal computing";"5";20000;20000;2011
"Ferrie, Frank FP";"Electrical and Computer Engineering";"McGill";"RGPIN";"Interpretation of visual models";"5";20000;20000;2011
"Fevens, Thomas TG";"Computer Science and Software Engineering";"Concordia";"RGPIN";"Computational geometry and applications";"1";14000;14000;2011
"Fisher, Brian BD";"Interactive Arts and Technology, School of (SIAT)";"Simon Fraser";"RGPIN";"Visual analytics models and systems";"1";14000;14000;2011
"Flocchini, Paola P";"Information Technology and Engineering, School of";"Ottawa";"RGPIN";"Computational issues in systems of mobile entities";"5";33000;33000;2011
"Galinier, Philippe P";"Genie informatique et genie logiciel";"Ecole Polytechnique";"RGPIN";"Metaheuristiques pour l'optimisation difficile";"5";20000;20000;2011
"Ganti, Sudhakar SNM";"Computer Science";"Victoria";"RGPIN";"Adaptive traffic management for high-capacity network architectures with smart services";"5";14000;14000;2011
"Gardoni, Mickaël M";"Genie de la production automatisee";"Ecole de technologie superieure";"RGPIN";"Methodes pour un système d'informations informelles dynamique";"5";14000;14000;2011
"Gebali, Fayez F";"Electrical and Computer Engineering";"Victoria";"RGPIN";"Multicore processing: Structured algorithm parallelization techniques & optimized network-on-chip design to connect to cores";"5";33000;33000;2011
"German, Daniel DM";"Computer Science";"Victoria";"RGPIN";"Source code licensing as an essential aspect of modern software development";"5";24000;24000;2011
"Gherbi, Abdelouahed A";"Genie logiciel et des TI";"Ecole de technologie superieure";"RGPIN";"Model-based engineering techniques for embedded and real-time software";"5";20000;20000;2011
"Giguère, Philippe P";"Informatique et de genie logiciel";"Laval";"RGPIN";"Improving perception of unknown environments or objects for robotic systems";"5";24000;24000;2011
"Girouard, Audrey A";"Computing, School of";"Queen's";"RGPIN";"Design and evaluation of new input and interaction techniques for flexible display surfaces";"5";20000;20000;2011
"Giroux, Sylvain S";"Informatique";"Sherbrooke";"RGPIN";"Des strategies d'assistance cognitive personnalisees et sensibles au contexte pour les personnes ayant des deficits cognitifs";"5";29000;29000;2011
"Glasgow, Janice JI";"Computing, School of";"Queen's";"RGPIN";"Intelligent systems for the assessment, diagnosis and treatment of stroke patients";"5";24000;24000;2011
"Goswami, Dhrubajyoti DG";"Computer Science and Software Engineering";"Concordia";"RGPIN";"Advancement of parallel systems skeletons";"5";24000;24000;2011
"Grassmann, Winfried WK";"Computer Science";"Saskatchewan";"RGPIN";"Theory and application of Markov modelling";"5";24000;24000;2011
"Green, Mark MW";"Science, Faculty of";"Ontario Institute of Technology";"RGPIN";"Interactive visualization of large scale scientific computations";"5";14000;14000;2011
"Gupta, Arvind A";"Computer Science";"British Columbia";"RGPIN";"Combinatorial algorithms in bioinformatics";"5";24000;24000;2011
"Hadley, Robert RF";"Computing Science";"Simon Fraser";"RGPIN";"Cognitive architecture, neural realism, and consciousness";"5";20000;20000;2011
"Hadzilacos, Vassos V";"Computer Science";"Toronto";"RGPIN";"Synchronisation and fault tolerance in distributed computing";"5";29000;29000;2011
"Halle, Sylvain S";"Informatique-mathematique";"Quebec a Chicoutimi";"RGPIN";"Specification, verification and enforcement of interface contracts with data";"5";20000;20000;2011
"Hamel, Sylvie S";"Informatique et recherche operationnelle";"Montreal";"RGPIN";"Algorithmic and combinatorial studies inspired by problems of comparative genomics";"5";20000;20000;2011
"Hancock, Mark MS";"Management Sciences";"Waterloo";"RGPIN";"Ubiquitous virtual tools: Providing ad-hoc multitouch interaction on nearby surfaces";"5";20000;20000;2011
"Hassanein, Khaled KS";"Business, DeGroote School of";"McMaster";"RGPIN";"Interactive decision support and adaptive Web interfaces for enhancing the online experience of older adults";"1";14000;14000;2011
"Hawkey, Kirstie KA";"Computer Science, Faculty of";"Dalhousie";"RGPIN";"Designing improved privacy and security interfaces";"5";20000;20000;2011
"Hayward, Ryan RB";"Computing Science";"Alberta";"RGPIN";"Algorithmic discrete mathematics with applications";"5";24000;24000;2011
"Hefeeda, Mohamed M";"Computing Science";"Simon Fraser";"RGPIN";"Mobile 3D multimedia streaming";"5";33000;33000;2011
"Hertzmann, Aaron AP";"Computer Science";"Toronto";"RGPIN";"Modeling human locomotion control";"5";60000;60000;2011
"Hoey, Jesse J";"Computer Science, David R. Cheriton School of";"Waterloo";"RGPIN";"Machine learning, dense sensing and decision theoretic planning for large-scale assistance systems";"5";29000;29000;2011
"Hoffman, Daniel DM";"Computer Science";"Victoria";"RGPIN";"Automated software testing with context-free grammars and covering arrays";"5";20000;20000;2011
"Holmes, Reid RT";"Computer Science, David R. Cheriton School of";"Waterloo";"RGPIN";"Understanding dynamic program behaviour";"5";24000;24000;2011
"Holt, Richard RC";"Computer Science, David R. Cheriton School of";"Waterloo";"RGPIN";"Mining Computing Configurations";"5";29000;29000;2011
"Hutchinson, Norman NC";"Computer Science";"British Columbia";"RGPIN";"The next generation of storage";"5";20000;20000;2011
"Jackson, Kenneth KR";"Computer Science";"Toronto";"RGPIN";"Numerical methods and software for applications in science, engineering and finance";"5";33000;33000;2011
"Jacobson Jr., Michael MJ";"Computer Science";"Calgary";"RGPIN";"Algorithms in number theory and cryptography";"5";33000;33000;2011
"Jagersand, Martin UM";"Computing Science";"Alberta";"RGPIN";"Incremental modeling of geometry and appearance from video";"5";24000;24000;2011
"Jeffrey, David DJ";"Applied Mathematics";"Western Ontario";"RGPIN";"Algorithms for computer algebra applied to industrial modelling";"5";33000;33000;2011
"Jenkin, Michael MRM";"Computer Science and Engineering";"York";"RGPIN";"Perception for mobile agents";"5";29000;29000;2011
"Kabanza, Froduald F";"Informatique";"Sherbrooke";"RGPIN";"Planning and execution of actions for agents in dynamic environments";"5";20000;20000;2011
"Kapron, Bruce BM";"Computer Science";"Victoria";"RGPIN";"Foundational studies in privacy and security";"5";24000;24000;2011
"Kemme, Bettina B";"Computer Science, School of";"McGill";"RGPIN";"Data management in the cloud";"5";29000;29000;2011
"Khabbazian, Majid M";"Applied Computer Science and Administrative Studies";"Winnipeg";"RGPIN";"Developing distributed algorithms for the proximate internet";"5";20000;20000;2011
"King, Valerie V";"Computer Science";"Victoria";"RGPIN";"Algorithms for large scale networks";"5";29000;29000;2011
"Kotsireas, Ilias I";"Physics and Computer Science";"Wilfrid Laurier";"RGPIN";"Novel computational paradigms for combinatorial matrices";"5";14000;14000;2011
"Kranakis, Evangelos E";"Computer Science, School of";"Carleton";"RGPIN";"Algorithmic methods in wireless network computing";"5";33000;33000;2011
"Kunz, Manuela M";"Computing, School of";"Queen's";"RGPIN";"Algorithms and interfaces for improved image-guided surgery";"5";14000;14000;2011
"Kutulakos, Kiriakos KN";"Computer Science";"Toronto";"RGPIN";"Foundations of computational photography and videography";"5";33000;33000;2011
"Kwiatkowska, Bogumila BM";"Computing Science";"Thompson Rivers";"RGPIN";"A knowledge-based framework for the management of imprecision in data";"5";14000;14000;2011
"Labiche, Yvan Y";"Systems and Computer Engineering";"Carleton";"RGPIN";"On integration testing object-oriented software systems";"5";33000;33000;2011
"Langer, Michael IMS";"Computer Science, School of";"McGill";"RGPIN";"Human-assisted computer vision";"5";20000;20000;2011
"Lank, Edward EH";"Computer Science, David R. Cheriton School of";"Waterloo";"RGPIN";"Facilitating pointing in graphical interfaces via kinematic analysis of user trajectories";"1";15000;15000;2011
"Larose, Benoît B";"Mathematics and Statistics";"Concordia";"RGPIN";"Applications of algebra to the study of fine-grained computational complexity of constraint satisfaction problems";"5";20000;20000;2011
