"Name";"Deparment";"Institution";"Program";"Title";"Term";"amount"
"ABIDI, SYED SIBTE RAZA SSR";"Computer Science, Faculty of";"Dalhousie";"RGPIN";"An Agile Semantic Web Platform for Knowledge-Centric Decision Support";"5";15000
"Aboulnaga, Ashraf AI";"Computer Science, David R. Cheriton School of";"Waterloo";"RGPIN";"Systems and Algorithms for Big Data Analytics";"5";25000
"Aimeur, Esma E";"Informatique et recherche operationnelle";"Montreal";"RGPIN";"Learning in the age of exposure";"5";30000
"AIT MOHAMED, Otmane O";"Electrical and Computer Engineering";"Concordia";"RGPIN";"Verification Framework and Tools for Highly Reliable Cyber-Physical Systems";"5";20000
"Alhajj, Reda RA";"Computer Science";"Calgary";"RGPIN";"Effective and Efficient Data Analysis Techniques for Emerging Data Intensive Applications";"5";15000
"Alim, Usman UR";"Computer Science";"Calgary";"RGPIN";"Approximation of Divergence-free Vector Fields on Regular Lattices";"5";20000
"Almhana, Jalal JA";"Informatique";"Moncton";"RGPIN";"Modelling and Optimising Cognitive Radio Networks";"5";15000
"AMAR BENSABER, BOUCIF B";"Mathematiques et informatique";"Quebec a Trois-Rivieres";"RGPIN";"Conception et developpement de nouveaux protocoles de securite pour les reseaux ad hoc vehiculaires intelligents (VANETs).";"5";15000
"Amyot, Daniel D";"Electrical Engineering and Computer Science , School of";"Ottawa";"RGPIN";"Goal and Aspect-oriented Business Process Engineering (GAoBPE)";"5";30000
"Ashlock, Daniel DAA";"Mathematics and Statistics";"Guelph";"RGPIN";"Representation and Applications of Evolutionary Computation to Bioinformatics, Optimization, and Games.";"5";20000
"Azevedo, Roger R";"Educational/Counselling Psychology";"McGill";"RGPIN";"Affectively-Responsive Multi-Agent Adaptive Learning Environments";"5";30000
"Baljko, Melanie MA";"Computer Science and Engineering";"York";"RGPIN";"Embodied Interaction Design for Articulation Elicitation and Feedback";"5";15000
"Bandyopadhyay, Subir S";"Computer Science, School of";"Windsor";"RGPIN";"Optimal design of optical WDM networks";"5";15000
"Barbosa, Denilson DM";"Computing Science";"Alberta";"RGPIN";"Robust and Scalable Knowledge Extraction from the Web";"5";30000
"Beaudry, Martin M";"Sciences, Faculte des";"Sherbrooke";"RGPIN";"Langages formels, algebres finies et automates.";"5";20000
"Bellec, Pierre PL";"Informatique et recherche operationnelle";"Montreal";"RGPIN";"Data mining in large functional neuroimaging databases";"5";15000
"Ben Hamza, Abdessamad A";"Concordia Institute for Information Systems Engineering (CIISE)";"Concordia";"RGPIN";"A spectral geometric framework for 3D shape analysis and applications";"5";20000
"Benyoucef, Morad F";"Telfer School of Management";"Ottawa";"RGPIN";"Enabling Social Commerce - A New Form of E-commerce that Leverages Social Ties Between Users";"5";15000
"Beznosov, Konstantin V";"Electrical and Computer Engineering";"British Columbia";"EQPEQ";"A Platform for Experimental Research on Modern Online Social Networks";"1";55586
"Bilodeau, Guillaume-Alexandre GA";"Genie informatique et genie logiciel";"Ecole Polytechnique";"EQPEQ";"Spherical Vision for Visual Surveillance";"1";16063
"Blondin Masse, Alexandre A";"Informatique-mathematique";"Quebec a Chicoutimi";"RGPIN";"Modeles combinatoires pour la representation et l'encodage de figures discretes";"5";20000
"Blustein, William James WJ";"Computer Science, Faculty of";"Dalhousie";"RGPIN";"Finding and Using Information in e-Documents";"5";15000
"Boulanger, Pierre PB";"Computing Science";"Alberta";"RGPIN";"Skill Transfer and Evaluation of Minimally Invasive Surgery Procedures Using Visuo-haptic Communication";"5";25000
"Boutilier, Craig E";"Computer Science (St. George Campus)";"Toronto";"RGPIN";"Computational Preference Assessment and Optimization for Group Decision Support";"5";66000
"Boyd, Jeffrey E";"Computer Science";"Calgary";"RGPIN";"Vision and Sensing of Human Motion for Athletes and Artists";"5";15000
"Boyd, Sylvia S";"Electrical Engineering and Computer Science , School of";"Ottawa";"RGPIN";"Applying Methods from Combinatorial Optimization in Solving Large-Scale Real World Problems";"5";25000
"Bradbury, Jeremy JS";"Science, Faculty of";"Ontario Institute of Technology";"RGPIN";"Testing and analysis of concurrent and heterogeneous computing software";"5";15000
"Bridson, Robert RE";"Computer Science";"British Columbia";"RGPIN";"Numerical and Geometric Algorithms for Virtual Practical Effects";"5";62000
"Brlek, Srecko S";"Informatique";"Quebec a Montreal";"RGPIN";"Combinatorics on words and digital geometry";"5";25000
"Bruce, Neil NDB";"Computer Science";"Manitoba";"RGPIN";"Computational Modeling and Analysis of Human Gaze Behavior";"5";20000
"Chaib-draa, Brahim B";"Informatique et de genie logiciel";"Laval";"RGPIN";"Uncertainty, Action & Interaction: in Pursuit of Cognitive Information Processing";"5";30000
"Chiang, Fei Yen FY";"Computing and Software";"McMaster";"RGPIN";"Improving Data Quality in Protected and Dynamic Data Environments";"5";20000
"Chignell, Mark H";"Mechanical and Industrial Engineering";"Toronto";"RGPIN";"Confidential Reasoning about Data Using Abstract Types as Meaningful Proxies";"5";25000
"Childs, Andrew AM";"Combinatorics and Optimization";"Waterloo";"RGPIN";"Algorithms for quantum computers";"5";44000
"Cleve, Richard RE";"Computer Science, David R. Cheriton School of";"Waterloo";"RGPIN";"Quantum information and complexity theory";"5";36000
"Consens, Mariano MP";"Mechanical and Industrial Engineering";"Toronto";"RGPIN";"Managing Linked Data in the Cloud";"5";25000
"Courville, Aaron C";"Informatique et recherche operationnelle";"Montreal";"RGPIN";"Probabilistic Models for Automatic Equivariant Feature Discovery";"5";15000
"Daley, Mark MJ";"Computer Science";"Western Ontario";"RGPIN";"Natural computation in the mesoscale dynamics of the brain";"5";30000
"De Sterck, Hans HJM";"Applied Mathematics";"Waterloo";"RGPIN";"Multilevel Algorithms for Tensor and Network Problems";"5";36000
"Dehne, Frank F";"Computer Science, School of";"Carleton";"EQPEQ";"Personalized human protein interactomes";"1";13015
"Derpanis, Konstantinos K";"Computer Science";"Ryerson";"RGPIN";"Spatiotemporal Models for Analyzing and Understanding Video";"5";20000
"Dudek, Gregory L";"Computer Science, School of";"McGill";"RGPIN";"Multi-agent robotic interaction";"1";30000
"Duong, Luc LY";"Genie logiciel et des TI";"Ecole de technologie superieure";"EQPEQ";"Electromagnetic measurement system for intravascular motion compensation";"1";22000
"Dymond, Patrick PW";"Computer Science and Engineering";"York";"RGPIN";"Searching, algorithms and complexity";"5";15000
"Eavis, Todd J";"Computer Science and Software Engineering";"Concordia";"RGPIN";"Business Intelligence and Analytics in the Elastic Cloud";"5";15000
"El Saddik, Abdulmotaleb AE";"Electrical Engineering and Computer Science , School of";"Ottawa";"RGPIN";"Towards innovative methods for multimodal interactions with advanced media and serious gaming";"5";36000
"El-Mabrouk, Nadia NS";"Informatique et recherche operationnelle";"Montreal";"RGPIN";"Evolution of Genome Organization";"5";36000
"Faloutsos, Petros P";"Computer Science and Engineering";"York";"RGPIN";"Authoring and Analyzing Crowd Simulations";"5";25000
"Farzad, Babak B";"Mathematics";"Brock";"RGPIN";"Algorithmic and Computational Graph Theory and Game Theory";"5";15000
"Fels, Sidney S";"Electrical and Computer Engineering";"British Columbia";"EQPEQ";"8 Channel Multipurpose MRI coil for High Speed MR Imaging";"1";47125
"Fernandez, Jose Manuel JM";"Genie informatique et genie logiciel";"Ecole Polytechnique";"RGPIN";"Evaluating the risk reduction value of security products against mass market cyber crime";"5";20000
"Fischmeister, Sebastian SN";"Electrical & Computer Engineering";"Waterloo";"RGPIN";"Rigorous Empirical Performance Analysis of Embedded Systems";"5";36000
"Fischmeister, Sebastian SN";"Electrical & Computer Engineering";"Waterloo";"EQPEQ";"Embedded Software Validation Laboratory";"1";43590
"Fleming, Michael MW";"Computer Science, Faculty of";"New Brunswick";"RGPIN";"Modeling user preferences in the design of decision-making agents";"5";15000
"Fournier-Viger, Philippe P";"Informatique";"Moncton";"RGPIN";"Algorithms, data structures and visualization for sequence analysis and prediction";"5";20000
"Frey, Brendan BJ";"Electrical & Computer Engineering";"Toronto";"RGPIN";"A Unified Computational Model of Gene Regulation";"5";52000
"Friedlander, Michael MP";"Computer Science";"British Columbia";"RGPIN";"Large-scale optimization: algorithm design and analysis";"5";36000
"Fung, Benjamin BCM";"Concordia Institute for Information Systems Engineering (CIISE)";"Concordia";"RGPIN";"Privacy-Preserving Data Sharing for Health Data Mining";"5";30000
"Gagne, Caroline C";"Sciences economiques et administratives DSEA";"Quebec a Chicoutimi";"RGPIN";"Optimization-based decision support systems for multiobjective decision making";"5";20000
"Ganesh, Vijay V";"Electrical & Computer Engineering";"Waterloo";"RGPIN";"Next-generation Constraint Solvers for Software Engineering and Security";"5";25000
"Gasevic, Dragan D";"Computing & Information Systems, School of";"Athabasca";"RGPIN";"Learning Analytics for Adaptive Systems supporting Self-regulated Social Learning";"5";15000
"Ghaderi Dehkordi, Majid M";"Computer Science";"Calgary";"RGPIN";"Exploiting Interference in Wireless Networks: Protocol Design, Analysis and Implementation";"5";20000
"Giesbrecht, Mark MW";"Computer Science, David R. Cheriton School of";"Waterloo";"RGPIN";"High Performance Algorithms for Sparse and Structured Symbolic Computations";"5";36000
"Glasser, Uwe UP";"Computing Science, School of";"Simon Fraser";"RGPIN";"Situation Analysis Decision Support Systems Design";"5";30000
"Godfrey, Michael MW";"Computer Science, David R. Cheriton School of";"Waterloo";"RGPIN";"Investigating software artifact provenance";"5";20000
"Golab, Wojciech W";"Electrical & Computer Engineering";"Waterloo";"RGPIN";"Harnessing the power of next-generation shared memory multiprocessors";"5";25000
"Gromala, Diane DJ";"Interactive Arts and Technology, School of (SIAT)";"Simon Fraser";"RGPIN";"VR Systems for Body Image and Body Schema";"5";25000
"Gryz, Jaroslaw J";"Computer Science and Engineering";"York";"RGPIN";"Order Dependencies in Database Systems";"5";36000
"Gupta, Kamal K";"Engineering Science, School of";"Simon Fraser";"EQPEQ";"Additional modules for SFU Autonomous Mobile Manipulator";"1";49940
"Haarslev, Volker M";"Computer Science and Software Engineering";"Concordia";"RGPIN";"Design of optimization techniques and software architectures for description logic reasoners";"5";30000
"Hassanein, Khaled KS";"Business, DeGroote School of";"McMaster";"RGPIN";"Customized Decision Support for Older Adults in eCommerce Environments";"5";25000
"Hatala, Marek M";"Interactive Arts and Technology, School of (SIAT)";"Simon Fraser";"RGPIN";"Model and Methods for Determining Effectiveness of Open Learner Models";"5";20000
"Hayden, Patrick PM";"Computer Science, School of";"McGill";"RGPIN";"Computing the spectrum: Information physics from cryptography to cosmology";"5";62000
"Haynes, Ronald RD";"Mathematics and Statistics";"Memorial Univ. of Nfld";"RGPIN";"Parallel Space-Time Approaches for the Numerical Solution of Partial Differential Equations";"5";30000
"Head, Milena MM";"Business, DeGroote School of";"McMaster";"RGPIN";"Designing and Evaluating Engaging Interfaces for Educational Games";"5";15000
"Hunter, Aaron AM";"Computing and Academic Studies, School of";"BC Institute of Technology";"RGPIN";"Knowledge Representation for Vehicle to Grid Systems: Power Monitoring, Storage and Trade";"5";15000
"Ilie, Lucian L";"Computer Science";"Western Ontario";"EQPEQ";"Bioinformatics Tools for Advancing Genomics and Proteomics";"1";69333
"Irani, Pourang P";"Computer Science";"Manitoba";"RGPIN";"Transforming Ultra-Portable Devices into Information-Rich Appliances";"5";30000
"Jaseemuddin, Muhammad M";"Electrical and Computer Engineering";"Ryerson";"RGPIN";"Connectivity, Resource Management and Application-enabling Infrastructure for Networking of Smart Mobile Devices";"5";15000
"Jenkin, Michael RM";"Computer Science and Engineering";"York";"EQPEQ";"6DOF virtual reality tracker";"1";29414
"Jiang, Hui H";"Computer Science and Engineering";"York";"RGPIN";"Large-Scale Discriminative Modelling for Data-Intensive Speech and Language Processing";"5";25000
"Jodoin, Pierre-Marc PM";"Informatique";"Sherbrooke";"RGPIN";"Analyse de contenu et detection d'anomalies pour des applications en surveillance video et imagerie medicale.";"5";20000
"Jurisica, Igor I";"Computer Science (St. George Campus)";"Toronto";"RGPIN";"Developing novel heuristic methods for integrative computational biology";"5";44000
"Kadoury, Samuel S";"Genie informatique et genie logiciel";"Ecole Polytechnique";"RGPIN";"Topologically invariant manifold learning for medical imaging";"5";20000
"Karsten, Martin M";"Computer Science, David R. Cheriton School of";"Waterloo";"RGPIN";"Simplifying the Software Infrastructure of Computer and Communication Systems";"5";20000
"Kelly, Jonathan JS";"Aerospace Studies, Institute for";"Toronto";"RGPIN";"Continuous Self-Calibration for Lifelong Autonomy";"5";20000
"Keselj, Vlado V";"Computer Science, Faculty of";"Dalhousie";"RGPIN";"String-based and Unification-based Methodology for Text mining and Processing";"5";20000
"Khoury, Richard RE";"Software Engineering, Dept. of";"Lakehead";"RGPIN";"Microtext Processing";"5";15000
"Kiczales, Gregor J";"Computer Science";"British Columbia";"RGPIN";"Lightweight Language Abstractions";"5";30000
"Kienzle, Jorg JA";"Computer Science, School of";"McGill";"RGPIN";"Concern-Driven Software Development";"5";36000
"Krishnamurthy, Diwakar D";"Electrical and Computer Engineering";"Calgary";"RGPIN";"Performance evaluation and management of enterprise application systems";"5";20000
"Kry, Paul PG";"Computer Science, School of";"McGill";"RGPIN";"Physically Based Character Animation, Editing, Control, Deformation, and Contact";"5";36000
"Kumar, Vivekanandan S";"Computing & Information Systems, School of";"Athabasca";"RGPIN";"Self- and Co-Regulating Anthropomorphic Pedagogical Agents";"5";15000
"Kutulakos, Kiriakos KN";"Computer Science (St. George Campus)";"Toronto";"EQPEQ";"Computational and Optical Light Field Processing";"1";148152
"Lam, Patrick P";"Electrical & Computer Engineering";"Waterloo";"RGPIN";"Combining domain-specific and general-purpose languages to improve program analysis";"5";20000
"Lang, Jochen J";"Electrical Engineering and Computer Science , School of";"Ottawa";"EQPEQ";"A high-resolution omnidirectional video camera for computational photography";"1";26175
"Lang, Jochen J";"Electrical Engineering and Computer Science , School of";"Ottawa";"RGPIN";"Computational Photography for Capturing Virtual Environments";"5";15000
"Larson, Katherine KS";"Computer Science, David R. Cheriton School of";"Waterloo";"RGPIN";"Strategic Interactions in Multiagent Systems";"5";30000
"L'ECUYER, Pierre P";"Informatique et recherche operationnelle";"Montreal";"RGPIN";"Modeling and Simulation of Stochastic Systems";"5";52000
"LEE, WonSook W";"Electrical Engineering and Computer Science , School of";"Ottawa";"EQPEQ";"Functional Center of Rotation for Hip Joint";"1";25700
"Levesque, Hector HJ";"Computer Science (St. George Campus)";"Toronto";"RGPIN";"Representation and reasoning for autonomous agents";"5";36000
"Levine, Martin D";"Electrical and Computer Engineering";"McGill";"RGPIN";"Here's looking at you! Describing Spatio-Temporal Human Events";"5";25000
"Li, Kin KF";"Electrical and Computer Engineering";"Victoria";"RGPIN";"Infrastructures, methods, and tools for mining and analyzing personal behavior for innovative recommender and learning systems using hardware accelerators";"5";20000
"Lie, David DJ";"Electrical & Computer Engineering";"Toronto";"RGPIN";"An Information Flow Approach to Data Security";"5";30000
"Lingras, Pawan PJ";"Mathematics and Computing Science";"Saint Mary's";"RGPIN";"Recursive and iterative clustering in granular hierarchical, network, and temporal datasets";"5";20000
"Litoiu, Marin M";"Information Technology, School of";"York";"RGPIN";"Adaptive Mechanisms for Large Scale Software Systems";"5";25000
"Little, James J";"Computer Science";"British Columbia";"RGPIN";"Places and Activities: Video and Robots";"5";36000
"Logrippo, Luigi L";"Informatique et d'ingenierie";"Quebec en Outaouais";"RGPIN";"Data Protection in Organization Workflows and Service Oriented Architectures";"5";25000
"Lucet, Yves YPL";"Okanagan - Computer Science, Mathematics, Physics and Statistics";"British Columbia";"RGPIN";"Computer-Aided Nonsmooth Analysis and Applications";"5";20000
"Lyons, Kelly A";"Information, Faculty of";"Toronto";"RGPIN";"Interaction Systems for Smarter Service Engagements";"5";15000
"MacCaull, Wendy WA";"Mathematics, Statistics and Computing Sciences";"St. Francis Xavier";"RGPIN";"Ontology-driven and adaptive workflow in distributed settings";"5";20000
"MacLean, Karon KE";"Computer Science";"British Columbia";"RGPIN";"Foundations and Applications of Affective Touch";"5";36000
"Madhavji, Nazim NH";"Computer Science";"Western Ontario";"RGPIN";"A Program of Research in Requirements Engineering";"5";20000
"Majumdar, Shikharesh S";"Systems and Computer Engineering";"Carleton";"RGPIN";"High Performance Parallel and Distributed Systems: Resource Management and Middleware";"5";25000
"Mandryk, Regan L";"Computer Science";"Saskatchewan";"RGPIN";"Modeling emotion unobtrusively in interactive digital systems";"5";36000
"Martin, Patrick TP";"Computing, School of";"Queen's";"RGPIN";"QoS-Aware Management of Cloud Applications";"5";20000
"Matrawy, Ashraf AAA";"Information Technology, School of";"Carleton";"RGPIN";"Security in mobile environments";"5";20000
"Maurer, Frank FO";"Computer Science";"Calgary";"RGPIN";"Software Processes for Small Teams Developing Scalable Applications in the Cloud";"5";25000
"McGuffin, Michael MJ";"Genie logiciel et des TI";"Ecole de technologie superieure";"RGPIN";"Multipoint Input Techniques for Information Visualization";"5";30000
"McIlraith, Sheila SA";"Computer Science (St. George Campus)";"Toronto";"RGPIN";"Software, Devices, Data, and People: Working together in the wired world";"5";52000
"Memisevic, Roland F";"Informatique et recherche operationnelle";"Montreal";"RGPIN";"Learning to represent images and their relations";"5";20000
"Menelas, Bob-Antoine Jerry BJ";"Informatique-mathematique";"Quebec a Chicoutimi";"RGPIN";"Exploitation d'interactions 3d multimodales pour remplacer ou renforcer un retour visuel dans un environnement d'utilisation non-controle.";"5";20000
"Miller, Renee RJM";"Computer Science (St. George Campus)";"Toronto";"RGPIN";"Big Data Curation";"5";44000
"Miri, Ali SA";"Computer Science";"Ryerson";"RGPIN";"Security and Privacy in the Cloud";"5";25000
"MISSAOUI, Rokia R";"Informatique et d'ingenierie";"Quebec en Outaouais";"RGPIN";"Social Network Analysis and Mining";"5";20000
"Mohar, Bojan B";"Mathematics";"Simon Fraser";"RGPIN";"Algebraic and Topological Methods in Graph Theory";"5";75000
"Moreno Maza, Marc M";"Computer Science";"Western Ontario";"RGPIN";"Hardware Acceleration Technologies Enabling Polynomial System Solving";"5";20000
"Morin, Patrick R";"Computer Science, School of";"Carleton";"RGPIN";"Geometric Data Structures";"5";36000
"Mudur, Sudhir Pandurang SP";"Computer Science and Software Engineering";"Concordia";"RGPIN";"Augmenting 3D Modeling and Animation Techniques Using Large Sensed Data";"5";15000
"Mullins, John J";"Genie informatique et genie logiciel";"Ecole Polytechnique";"RGPIN";"Methodes formelles d'analyse quantitative de la securite de l'information partiellement observable dans les systemes ouverts";"5";15000
"Nayak, Amiya A";"Electrical Engineering and Computer Science , School of";"Ottawa";"RGPIN";"Algorithms for fault tolerance in emerging smart power grids";"5";25000
"Ngatched Nkouatchah, Telex Magloire TM";"Grenfell Campus";"Memorial Univ. of Nfld";"RGPIN";"Queuing Analysis of Opportunistic Access in Multichannel Cognitive Radios";"1";20000
"Nguyen, Uyen Trang UTH";"Computer Science and Engineering";"York";"RGPIN";"Network Coding Based Multicast in Multi-channel Multi-radio Wireless Mesh Networks";"5";15000
"Nie, Jian-Yun JY";"Informatique et recherche operationnelle";"Montreal";"RGPIN";"Search intelligence as users expect";"5";44000
"Niu, Di D";"Electrical and Computer Engineering";"Alberta";"RGPIN";"Intelligent Internet-Scale Multimedia Storage and Delivery";"5";25000
"Orchard, Jeff JJ";"Computer Science, David R. Cheriton School of";"Waterloo";"RGPIN";"Neural Computing with Oscillations";"5";15000
"Ozell, Benoit B";"Genie informatique et genie logiciel";"Ecole Polytechnique";"RGPIN";"Environnement d'analyse et de communication des resultats numeriques en visualisation scientifique";"5";15000
"Panario, Daniel D";"Mathematics and Statistics, School of";"Carleton";"RGPIN";"Computations in finite fields and probabilistic analysis of algorithms";"5";36000
"Pazzi, Richard RW";"Business and Information Technology, Faculty of";"Ontario Institute of Technology";"RGPIN";"Social Network-based Data Dissemination in Vehicular Sensor Networks to Support Distributed Monitoring Services";"5";20000
"Pelc, Andrzej A";"Informatique et d'ingenierie";"Quebec en Outaouais";"RGPIN";"Distributed network algorithms";"5";44000
"Peters, Joseph JG";"Computing Science, School of";"Simon Fraser";"RGPIN";"Modelling and Analysis of Dynamic Networks";"5";15000
"Pierre, Samuel S";"Genie informatique et genie logiciel";"Ecole Polytechnique";"RGPIN";"Reseautique du futur";"5";36000
"Poupart, Pascal P";"Computer Science, David R. Cheriton School of";"Waterloo";"RGPIN";"Lifelong Machine Learning and Sequential Decision Making for Natural Language Interfaces";"5";44000
"Rafiei, Davood D";"Computing Science";"Alberta";"RGPIN";"Enabling queries on relational data on the Web";"5";30000
"Rekleitis, Ioannis I";"Computer Science, School of";"McGill";"RGPIN";"Autonomous Exploration of Challenging Environments";"5";15000
"Rigby, Peter PC";"Computer Science and Software Engineering";"Concordia";"RGPIN";"Contemporary Software Peer Review: Modern practices, fault prediction, and extraction of design decisions";"5";25000
"Rokne, Jon JG";"Computer Science";"Calgary";"RGPIN";"Interval analysis, computer graphics algorithms and social networks";"5";15000
"Rudzicz, Frank FR";"Computer Science (St. George Campus)";"Toronto";"RGPIN";"A control-theoretic model of speech production and recognition for use within prosthetic communication devices";"5";20000
"Saeedi, Parvaneh Akhtar P";"Engineering Science, School of";"Simon Fraser";"RGPIN";"Computer Vision for Infertility Treatment";"5";20000
"Salavatipour, Mohammad Reza MR";"Computing Science";"Alberta";"RGPIN";"Approximation Algorithms and Hardness of Approximation for Optimization Problems";"5";44000
"Salomaa, Kai KT";"Computing, School of";"Queen's";"RGPIN";"Automata with limited nondeterminism and applications of automata";"5";30000
"Samaan, Nancy A";"Electrical Engineering and Computer Science , School of";"Ottawa";"RGPIN";"Self-Management Mechanisms for Clouds Assisting Mobile Users";"5";20000
"Santoro, Nicola N";"Computer Science, School of";"Carleton";"RGPIN";"Distributed Computing and Mobility";"5";44000
"Sarkar, Anoop A";"Computing Science, School of";"Simon Fraser";"RGPIN";"Multilingual Statistical Machine Translation";"5";30000
"Schneider, Kevin KA";"Computer Science";"Saskatchewan";"RGPIN";"Evolving Software Collaboratively";"5";15000
"Schroeder, Bianca B";"Computer and Mathematical Sciences (Scarborough)";"Toronto";"RGPIN";"Reliable and energy-efficient next-generation data centres";"5";36000
"Schulte, Oliver N";"Computing Science, School of";"Simon Fraser";"RGPIN";"Learning Bayes Nets for Relational Data and Heterogenous Networks";"5";20000
"Schuurmans, Dale DE";"Computing Science";"Alberta";"RGPIN";"Learning Predictive Representations from Incomplete Data";"5";62000
"Shallit, Jeffrey JO";"Computer Science, David R. Cheriton School of";"Waterloo";"RGPIN";"Avoidability and Decidability in Formal Languages and Automata";"5";36000
"Sharlin, Ehud E";"Computer Science";"Calgary";"RGPIN";"Physicality in Human-Robot Interaction: Form, Movement, Proxemics and Touch";"5";15000
"Shen, Weiming W";"Electrical and Computer Engineering";"Western Ontario";"RGPIN";"Agent-Based Resilient and Secure Wireless Sensor Networks and Applications";"5";15000
"Siddiqi, Kaleem K";"Computer Science, School of";"McGill";"RGPIN";"Minimal Surfaces in the Heart";"5";36000
"Spiteri, Raymond J";"Computer Science";"Saskatchewan";"RGPIN";"Game-Changing Time Integration of Complex Systems for the Exaflop Era";"5";30000
"Stavness, Ian IK";"Computer Science";"Saskatchewan";"RGPIN";"High-Fidelity Simulation of Human Muscles and Movement";"5";20000
"St-Denis, Richard R";"Informatique";"Sherbrooke";"RGPIN";"A Theory of Discrete Event Systems as a Foundation for Component-Based Software Engineering/Une theorie des systemes a evenements discrets comme base a l'ingenierie du logiciel";"5";25000
"Storjohann, Arne A";"Computer Science, David R. Cheriton School of";"Waterloo";"RGPIN";"Algorithms for the exact solution to problems in linear algebra";"5";30000
"Suen, Ching CY";"Computer Science and Software Engineering";"Concordia";"RGPIN";"Error Reduction in Handwriting Recognition with Applications";"5";25000
"Taati, Babak B";"Computer Science (St. George Campus)";"Toronto";"RGPIN";"Vision-Based Evaluation of Mobility, Physical Health, and Rehabilitation Progress in Natural Settings";"5";20000
"Taylor, Graham GW";"Engineering, School of";"Guelph";"RGPIN";"Deep Learning and Representation Learning for Sequential Data";"5";25000
"Taylor, Graham GW";"Engineering, School of";"Guelph";"EQPEQ";"GPU infrastructure for large-scale machine learning";"1";93258
